<?xml version="1.0" encoding="UTF-8" ?>
<Persons xmlns="http://akhmelev.it-academy.by/xml-classwork"
          xmlns:xsi="http://www.w3.org/2001/XMLSchema-instance"
          xsi:schemaLocation="http://akhmelev.it-academy.by/xml-classwork ad.xsd">
    <Person>
        <Email>
            dorohov@mail.ru
        </Email>
        <Nickname>
            Dorohov
        </Nickname>
        <Password>
            qwertyuiop
        </Password>
        <Ads>
            <Ad>
                <Description>
                    Теплая уютная квартира в самом центре
                </Description>
                <Addres>
                    Минск, ул. Гикало, 12, кв.13
                </Addres>
                <Flat>4</Flat>
                <Flats>5</Flats>
                <Price>55555</Price>
                <Area>48.5</Area>

            </Ad>
            <Ad>
                <Description>
                    Уютная квартира в Уручье
                </Description>
                <Addres>
                    Минск, ул. Стариновская, 10, кв.113
                </Addres>
                <Flat>11</Flat>
                <Flats>16</Flats>
                <Price>85555</Price>
                <Area>58.9</Area>
            </Ad>
        </Ads>
    </Person>
</Persons>