<?xml version="1.0" encoding="UTF-8" ?>

<Persons xmlns="lesha_borisenok"
          xmlns:xsi="http://www.w3.org/2001/XMLSchema-instance"
          xsi:schemaLocation="lesha_borisenok ad.xsd">

    <Person>
        <Email>
            dorohov@mail.ru
                </Email>
        <Nickname>
            Dorohov
                </Nickname>
        <Password>
            qwertyuiop
                </Password>
        <Ads>
            <ad>
                <Description>
                    Тёплая уютная квартира в минске
                        </Description>
                <Address>
                    Минск, ул. Гикало, 12, кв.13
                        </Address>
                <Flat>4</Flat>
                <Flats>16</Flats>
                <Price>55555</Price>
                <Area>87.5</Area>
                    </ad>
                </Ads>
            </Person>

    <Person>
        <Email>
            dorgdfgv@mail.ru
        </Email>
        <Nickname>
            Ddfgdv
        </Nickname>
        <Password>
            qwerdfgp
        </Password>
        <Ads>
            <ad>
                <Description>
                    Тёплаяdfgвартира в минске
                </Description>
                <Address>
                    Минскdfgкало, 12, кв.13
                </Address>
                <Flat>6</Flat>
                <Flats>8</Flats>
                <Price>7855</Price>
                <Area>57.5</Area>
            </ad>
        </Ads>
    </Person>
</Persons>